Message Number,Speaker,Message Content,Topic
1,Student,"I am doing a API assignment and I finished all things. But I have a bug when I start the mongodb server right now, can you please help me?",Initial Problem
2,Student,"Error log: TypeError: newPendingTasks.forEach is not a function at /Users/youdong/mp3/routes/users.js:271:37",Error Details
3,Assistant,"I can help you fix this bug! The error shows that on line 271 in routes/users.js, you're trying to call .forEach() on newPendingTasks, but it's not an array. Could you please share the code around line 271?",Diagnosis Request
4,Student,"I will give you my users.js code can you please check it.",Code Sharing
5,Assistant,"Yes, please share your users.js code! I'll review it to find the bug causing the forEach error on line 271.",Code Review Offer
6,Student,[Shared users.js code file],Code Provided
7,Assistant,"Found the bug! On line 252: var newPendingTasks = req.body.pendingTasks || []; The problem is when req.body.pendingTasks exists but is not an array. Fix: Replace with Array.isArray(req.body.pendingTasks) ? req.body.pendingTasks : []",Solution Provided
8,Student,[Shared MongoDB Atlas dashboard screenshot showing cluster is online],Verification Question
9,Student,"How do I know if my MongoDB works well?",Testing Question
10,Assistant,"Your MongoDB is working! The dashboard shows: Green dot (cluster online), Active connection (1.0), Data transmission (734.06 B/s). To verify: 1) Check server logs for 'MongoDB connected successfully!' 2) Test API calls with curl or Postman 3) Browse Collections in Atlas 4) Restart server after applying the fix",Verification Guide
11,Student,[Shared assignment requirements screenshot showing example API queries],Assignment Context
12,Student,"I already downloaded Postman can you help me do the test. I have tasks.js and users.js two files.",Testing Request
13,Assistant,"Perfect! I can help you test with Postman. Please share your tasks.js code so I can create a complete testing guide for both users and tasks endpoints.",Testing Setup
14,Student,"I want to test it in the Postman.",Testing Confirmation
15,Assistant,"Created complete Postman testing guide covering: GET all users, POST create user, GET user by ID, Query parameters (where/sort/select/count/skip/limit), PUT update user, DELETE user. Included step-by-step instructions with URLs, headers, request bodies, and expected responses.",Postman Guide Provided
16,Student,"Give me conversation log in CSV file that I can submit to my professor.",Documentation Request
17,Assistant,Created CSV file with complete conversation log for assignment submission,File Creation
